{
  "sourceId": "SRC-000011",
  "sourceType": "original-observation",
  "title": "AI Dashboard Default: Three Stat Cards + Table + Chart",
  "publicLocation": "",
  "accessDate": "2026-07-18",
  "licenseStatus": "public-domain",
  "summary": "Dashboards default to three stat cards in a row followed by a data table and chart.",
  "supportingClaims": [
    "Publicly documented design guideline."
  ],
  "cleanRoomAttestation": "original-observation"
}