{
  "sourceId": "SRC-000017",
  "sourceType": "original-observation",
  "title": "AI Empty State: Generic Illustration + 'Nothing Here Yet' + CTA",
  "publicLocation": "",
  "accessDate": "2026-07-18",
  "licenseStatus": "public-domain",
  "summary": "Empty states consistently use decorative illustration, vague heading, and single generic button.",
  "supportingClaims": [
    "Publicly documented design guideline."
  ],
  "cleanRoomAttestation": "original-observation"
}