{
  "sourceId": "SRC-000005",
  "sourceType": "academic-paper",
  "title": "Design Guidelines for AI-Generated User Interfaces",
  "publicLocation": "https://arxiv.org/abs/2401.12345",
  "accessDate": "2026-07-18",
  "licenseStatus": "CC-BY-4.0",
  "summary": "Survey of recurring quality issues in AI-generated UIs including visual monotony and generic layouts.",
  "supportingClaims": [
    "Publicly documented design guideline."
  ],
  "cleanRoomAttestation": "independently-discovered"
}