{
  "sourceId": "SRC-000010",
  "sourceType": "publication",
  "title": "Material Design - Understanding Layout",
  "publicLocation": "https://m2.material.io/design/layout/understanding-layout.html",
  "accessDate": "2026-07-18",
  "licenseStatus": "CC-BY-4.0",
  "summary": "Guidance on responsive layout grids, breakpoints, spacing units, and content alignment.",
  "supportingClaims": [
    "Publicly documented design guideline."
  ],
  "cleanRoomAttestation": "independently-discovered"
}