{
  "sourceId": "SRC-000021",
  "sourceType": "original-observation",
  "title": "AI Pricing Table: Three Columns, Middle Column Highlighted",
  "publicLocation": "",
  "accessDate": "2026-07-18",
  "licenseStatus": "public-domain",
  "summary": "Pricing sections default to identical three-column layout with middle tier highlighted.",
  "supportingClaims": [
    "Publicly documented design guideline."
  ],
  "cleanRoomAttestation": "original-observation"
}