{
  "sourceId": "SRC-000003",
  "sourceType": "design-system-doc",
  "title": "Material Design 3 - Elevation",
  "publicLocation": "https://m3.material.io/styles/elevation",
  "accessDate": "2026-07-18",
  "licenseStatus": "CC-BY-4.0",
  "summary": "Google's guide on using elevation, shadows, and surface layering to communicate hierarchy.",
  "supportingClaims": [
    "Publicly documented design guideline."
  ],
  "cleanRoomAttestation": "independently-discovered"
}