{
  "sourceId": "SRC-000015",
  "sourceType": "original-observation",
  "title": "AI Table Default: Every Cell Bordered, Alternating Row Colors",
  "publicLocation": "",
  "accessDate": "2026-07-18",
  "licenseStatus": "public-domain",
  "summary": "Tables apply full borders to every cell and alternate row colors by default, creating visual noise.",
  "supportingClaims": [
    "Publicly documented design guideline."
  ],
  "cleanRoomAttestation": "original-observation"
}