{
  "sourceId": "SRC-000022",
  "sourceType": "original-observation",
  "title": "AI Mobile Menu: Slide-in from Right with Full-Height Overlay",
  "publicLocation": "",
  "accessDate": "2026-07-18",
  "licenseStatus": "public-domain",
  "summary": "Mobile navigation defaults to right-side slide-in drawer with semi-transparent backdrop overlay.",
  "supportingClaims": [
    "Publicly documented design guideline."
  ],
  "cleanRoomAttestation": "original-observation"
}