{
  "sourceId": "SRC-000025",
  "sourceType": "original-observation",
  "title": "AI Footer: Four-Column Link Grid with Newsletter Signup",
  "publicLocation": "",
  "accessDate": "2026-07-18",
  "licenseStatus": "public-domain",
  "summary": "Footers default to four-column layout with link groups and email input regardless of site structure.",
  "supportingClaims": [
    "Publicly documented design guideline."
  ],
  "cleanRoomAttestation": "original-observation"
}